{
  "$schema": "https://json-schema.org/draft/2020-12/schema",
  "$id": "https://clew.local/schemas/clew_record-0.4.1.json",
  "title": "Clew Record",
  "description": "Per-sample candidate extraction record produced by Clew v0.4.x. See docs/schema.md for the human-readable specification.",
  "type": "object",
  "additionalProperties": false,
  "required": [
    "sample_sha256",
    "sample_path",
    "clew_version",
    "capa_techniques",
    "derivation_status",
    "total_iterations",
    "candidates"
  ],
  "properties": {
    "sample_sha256": {
      "type": "string",
      "pattern": "^[a-f0-9]{64}$",
      "description": "SHA-256 of the analyzed binary, 64 lowercase hex chars."
    },
    "sample_path": {
      "type": ["string", "null"],
      "description": "Path to the binary at analysis time; nullable for redacted corpora."
    },
    "clew_version": {
      "type": "string",
      "pattern": "^\\d+\\.\\d+\\.\\d+$",
      "description": "Semantic version of the producing Clew tool."
    },
    "capa_techniques": {
      "type": "array",
      "items": { "type": "string" },
      "description": "capa rule names matched by Channel 0; empty array if capa not run or no matches."
    },
    "derivation_status": {
      "oneOf": [
        { "$ref": "#/$defs/DerivationStatus" },
        { "type": "null" }
      ],
      "description": "Sample-level derivation-pipeline status. Distinct from the per-candidate `evasion_tier` (defeatability tier). Null if classification was skipped."
    },
    "total_iterations": {
      "type": "integer",
      "minimum": 1,
      "description": "Always 1 in v1."
    },
    "candidates": {
      "type": "array",
      "items": { "$ref": "#/$defs/Candidate" },
      "description": "Empty array is valid and means no extractable env checks were found."
    }
  },

  "$defs": {
    "VA": {
      "type": "string",
      "pattern": "^0x[0-9a-fA-F]+$",
      "description": "Virtual address as hex string with 0x prefix."
    },

    "Tier": {
      "type": "string",
      "enum": ["tier_1", "tier_2", "tier_3", "tier_4"],
      "description": "Defeatability tier of an evasion technique. tier_1: single-call defeatable; tier_2: multi-call coordination; tier_3-4: crypto/timing/infeasible. Used per-candidate as `evasion_tier`."
    },

    "DerivationStatus": {
      "type": "string",
      "enum": ["fully_derivable", "partially_derivable", "not_derivable", "no_capa_signal"],
      "description": "Sample-level derivation-pipeline status, rolled up from per-rule actionability. fully_derivable: every matched capa rule is actionable (mapped in CAPA_RULE_TO_APIS AND all implied APIs in TARGET_ENV_APIS). partially_derivable: at least one matched rule is actionable AND at least one is not. not_derivable: no matched rules are actionable (all unmapped, all-outside-target, or mix of those failure modes). no_capa_signal: no matched anti-analysis rules at all (also assigned to samples where capa didn't successfully complete — timeouts, capa errors)."
    },

    "Channel": {
      "type": "string",
      "enum": ["capa", "floss", "bn_xref", "drio"]
    },

    "ApiResolution": {
      "type": "string",
      "description": "How the call to the API was resolved. The first four are static findings from Channel 2. 'runtime' means Channel 3 observed the call happen under instrumentation without the static pass having enumerated the call site -- so how it was reached was never determined, only that it was.",
      "enum": ["import", "getprocaddress", "ordinal", "hashed", "runtime"]
    },

    "ComparisonOperator": {
      "type": "string",
      "enum": [
        "equality",
        "inequality",
        "greater_than",
        "less_than",
        "greater_equal",
        "less_equal",
        "bitwise_and",
        "bitwise_or",
        "contains",
        "unknown"
      ]
    },

    "Represents": {
      "type": "string",
      "enum": [
        "sandbox_detected",
        "vm_detected",
        "debugger_detected",
        "analysis_tool_detected",
        "clean_environment",
        "threshold_value",
        "unknown"
      ]
    },

    "StringSource": {
      "type": "string",
      "enum": ["static", "stackstring", "tightstring", "decoded"]
    },

    "ScalarValue": {
      "type": ["string", "number", "boolean", "null"],
      "description": "A value that can be a string, number, boolean, or null. Used for parameter values and retarget targets."
    },

    "ChannelArray": {
      "type": "array",
      "minItems": 1,
      "uniqueItems": true,
      "items": { "$ref": "#/$defs/Channel" }
    },

    "CandidateValue": {
      "type": "object",
      "additionalProperties": false,
      "required": ["value", "represents", "retarget_to", "confidence", "source_channels"],
      "properties": {
        "value": { "$ref": "#/$defs/ScalarValue" },
        "represents": { "$ref": "#/$defs/Represents" },
        "retarget_to": { "$ref": "#/$defs/ScalarValue" },
        "confidence": {
          "type": "number",
          "minimum": 0,
          "maximum": 1
        },
        "source_channels": { "$ref": "#/$defs/ChannelArray" }
      }
    },

    "ComparisonCandidate": {
      "type": "object",
      "additionalProperties": false,
      "required": ["comparison_operator", "cmp_operand_a", "cmp_operand_b", "confidence", "source_channels"],
      "properties": {
        "comparison_operator": { "$ref": "#/$defs/ComparisonOperator" },
        "cmp_operand_a": { "type": ["string", "null"] },
        "cmp_operand_b": { "type": ["string", "null"] },
        "confidence": {
          "type": "number",
          "minimum": 0,
          "maximum": 1
        },
        "source_channels": { "$ref": "#/$defs/ChannelArray" },
        "binding": {
          "type": "string",
          "enum": ["temporal", "proximity"],
          "description": "How this comparison was tied to the candidate. 'temporal' means it executed after the traced API call returned, in the same thread, before any other traced call -- an ordering the instrumentation observed. 'proximity' means its address merely fell in a window after the static call site, which is a guess. Absent on records produced before this distinction existed."
        }
      },
      "description": "One Channel-3-correlated runtime comparison for a candidate. Ranked entries collect in the candidate's comparison_candidates array."
    },

    "CoordinationConstraint": {
      "type": "object",
      "additionalProperties": false,
      "required": ["gate_group_id", "description"],
      "properties": {
        "gate_group_id": { "type": ["string", "null"] },
        "description": { "type": ["string", "null"] }
      }
    },

    "Evidence": {
      "type": "object",
      "additionalProperties": false,
      "required": [
        "channels",
        "string_source",
        "string_va",
        "string_function_va",
        "dataflow_path",
        "cmp_operand_a",
        "cmp_operand_b"
      ],
      "properties": {
        "channels": { "$ref": "#/$defs/ChannelArray" },
        "string_source": {
          "oneOf": [
            { "$ref": "#/$defs/StringSource" },
            { "type": "null" }
          ]
        },
        "string_va": {
          "oneOf": [
            { "$ref": "#/$defs/VA" },
            { "type": "null" }
          ]
        },
        "string_function_va": {
          "oneOf": [
            { "$ref": "#/$defs/VA" },
            { "type": "null" }
          ]
        },
        "dataflow_path": {
          "type": "array",
          "items": { "$ref": "#/$defs/VA" }
        },
        "cmp_operand_a": { "type": ["string", "null"] },
        "cmp_operand_b": { "type": ["string", "null"] }
      }
    },

    "Candidate": {
      "type": "object",
      "additionalProperties": false,
      "required": [
        "call_site_va",
        "function_va",
        "api_name",
        "api_resolution",
        "parameter_index",
        "comparison_operator",
        "evasion_tier",
        "iteration_number",
        "candidate_values",
        "coordination_constraint",
        "evidence"
      ],
      "properties": {
        "call_site_va": { "$ref": "#/$defs/VA" },
        "function_va": {
          "anyOf": [{ "$ref": "#/$defs/VA" }, { "type": "null" }],
          "description": "Start of the function containing the call site, for grouping a routine's candidates and for cross-referencing back into Binary Ninja. Null when nothing determines it: Channel 3 can observe exactly where a call happened, but which function an address belongs to is a product of static analysis, and for a call site Channel 2 never reached there is often no function it identified at all."
        },
        "api_name": {
          "type": "string",
          "minLength": 1
        },
        "api_resolution": { "$ref": "#/$defs/ApiResolution" },
        "parameter_index": {
          "type": "integer",
          "minimum": -1,
          "description": "-1 means the check is on the return value; >= 0 is a parameter index."
        },
        "comparison_operator": { "$ref": "#/$defs/ComparisonOperator" },
        "comparison_candidates": {
          "type": "array",
          "items": { "$ref": "#/$defs/ComparisonCandidate" },
          "description": "Optional. Channel-3-correlated runtime comparisons for this candidate, ranked confidence-descending. Absent on pre-correlation intermediate records; the legacy comparison_operator and evidence.cmp_operand_a/_b mirror element [0]."
        },
        "evasion_tier": { "$ref": "#/$defs/Tier" },
        "iteration_number": {
          "type": "integer",
          "minimum": 0
        },
        "candidate_values": {
          "type": "array",
          "minItems": 1,
          "items": { "$ref": "#/$defs/CandidateValue" }
        },
        "coordination_constraint": { "$ref": "#/$defs/CoordinationConstraint" },
        "evidence": { "$ref": "#/$defs/Evidence" }
      }
    }
  }
}