{
  "sample_sha256": "1fe91674eb8daacd14ab42926a303fd16b6b21dfaed2c65b2862dcb41197d119",
  "sample_path": "tests/fixtures/al-khaser_x86.exe",
  "clew_version": "0.1.0",
  "capa_techniques": [
    "acquire debug privileges",
    "check for debugger via API",
    "check for hardware breakpoints",
    "check for kernel debugger via shared user data structure",
    "check for OutputDebugString error",
    "check for PEB BeingDebugged flag",
    "check for PEB NtGlobalFlag flag",
    "check for protected handle exception",
    "check for software breakpoints",
    "check for time delay via GetTickCount",
    "check for trap flag exception",
    "check for unexpected memory writes",
    "check for unmoving mouse cursor",
    "check if process is running under wine",
    "check process job object",
    "execute anti-debugging instructions",
    "find graphical window",
    "reference analysis tools strings",
    "reference anti-VM strings",
    "reference anti-VM strings targeting Parallels",
    "reference anti-VM strings targeting Qemu",
    "reference anti-VM strings targeting VirtualBox",
    "reference anti-VM strings targeting VirtualPC",
    "reference anti-VM strings targeting VMWare",
    "reference anti-VM strings targeting Xen"
  ],
  "derivation_status": "fully_derivable",
  "total_iterations": 1,
  "candidates": [
    {
      "call_site_va": "0x00434d4a",
      "function_va": "0x00434d20",
      "api_name": "IsDebuggerPresent",
      "api_resolution": "import",
      "parameter_index": -1,
      "comparison_operator": "equality",
      "evasion_tier": "tier_1",
      "iteration_number": 0,
      "candidate_values": [
        {
          "value": true,
          "represents": "debugger_detected",
          "retarget_to": false,
          "confidence": 0.9,
          "source_channels": ["capa", "bn_xref"]
        }
      ],
      "coordination_constraint": {
        "gate_group_id": null,
        "description": null
      },
      "evidence": {
        "channels": ["capa", "bn_xref"],
        "string_source": null,
        "string_va": null,
        "string_function_va": null,
        "dataflow_path": ["0x00434d20", "0x00434d4a"],
        "cmp_operand_a": null,
        "cmp_operand_b": null
      }
    }
  ]
}
